"title","negative","positive","sentiment_score"
"У Києві починається «Марш рівності»",1,1,0
"У Дніпрі стартував всеукраїнський фестиваль блогерів",2,4,2
"Омбудсмен: публічна дискусія довкола Маршу рівності набуває загрозливої забарвленості",1,0,-1
"У день відкриття саміту G7 у світі проводять глобальну акцію #SaveOlegSentsov",4,5,1
"Лідери ЄС виступили проти повернення Росії до «Групи семи»",1,4,3
"Канада пов’язує повернення Росії до «Групи семи» з деокупацією Криму",1,2,1
"Трамп: Росія має брати участь у саміті «Групи семи»",2,4,2
"Чи достатньо у Верховній Раді жінок-депутатів?",4,0,-4
"Під офісом омбудсмена посварились прихильники та супротивники звільнення Філіпішиної",9,8,-1
"Уряд має активно протистояти дискримінації ЛГБТ – Покальчук",4,1,-3
"Що відбувається із ромськими поселеннями у Києві",15,7,-8
"Вартість свічок РПЦ обвалилася до історичного мінімуму: реакція соцмереж на заяву Порошенка про єдину помісну церкву",7,10,3
"Радіо Свобода Daily: Порошенко проситиме томос про Українську помісну автокефальну церкву",3,10,7
"Гендерна рівність потрібна не лише жінкам, але і чоловікам – експерти",3,4,1
"Обережно, міни! Скільки вибухонебезпечних знахідок приховує Донбас? – Ранковий ефір Радіо Свобода",0,1,1
"Зірвані плакати, заблоковані дискусії: наскільки безпечно в Україні говорити про права людини",2,2,0
"​Якщо ми не будемо враховувати гендерну рівність, у багато дверей ми просто не зайдемо – Чернишов",3,3,0
"Подорож до Антарктиди-2018: це остання річна експедиція, яка складається виключно з чоловіків",1,0,-1
"У Німеччині сформували «велику коаліцію» та домовилися про уряд",2,4,2
"Чому деякі феміністки України бойкотують марш «Годі терпіти»? (Світова преса)",5,4,-1
"У структурі МВС працюють понад 50 тисяч жінок – заступник міністра",0,8,8
"Гендерна нерівність: п’ять порушень прав жінок в Україні",9,5,-4
"Радіо Свобода Daily: анонімні свідчення представників командування «ПВК Вагнера»",5,3,-2
"Цьогорічний Docudays UA: Музикант Шуров долучився до руху ООН за рівні права",2,0,-2
"«Дорогі жіночки...». Сексизм, квіти і флешмоб до 8 березня (огляд соцмереж)",4,3,-1
"Робота як вибір: у Києві мітингували за декриміналізацію комерційного сексу",5,1,-4
"Розслідування злочинів ненависті щодо ЛГБТ в Україні залишається невирішеним – Муйжнієкс",8,1,-7
"Москаль: першою має попросити вибачення Супрун",4,3,-1
"Депутатське об’єднання щодо гендерної рівності засудило лайливі слова Москаля на адресу Супрун",6,3,-3
"«Втома від України» у Вашингтоні є безпідставною (світова преса) ",4,9,5
"Візочки – для дівчаток, машинки – для хлопчиків: яких тат хоче бачити українське суспільство?",16,7,-9
"Аваков заявив, що Дєєва працює його радником «на громадських засадах»",1,0,-1
"Роль жінок у зміцненні миру в Україні (дослідження)",2,12,10
"Непокараність злочинів в Україні – одне з найбільших занепокоєнь HRW",14,8,-6
"З фінансування інтернатів тільки 30% йде на дітей – Філіпішина ",4,0,-4
"Більшість клопотань жінок про помилування – від засуджених за вбивство свого кривдника – Левченко",11,10,-1
"У час кризи жінці ще складніше повідомляти про насильство – Дмитрієва",6,0,-6
"Україна і Канада: Фріланд у Києві говорить про зброю та українські інтереси",7,11,4
"Кількість дітей-жертв насильства може сягати мільйонів – Філіпішина",8,4,-4
"«Безвіз» Україні та летальна зброя від Канади як винагорода за подолання корупції – рекомендації комітету Палати громад",2,2,0
"Рада ухвалила за основу законопроект про рівність жінок і чоловіків у війську: що він змінює?",4,3,-1
"Брюссельський саміт повторив про «європейські прагнення» України, а Порошенко домігся «вишеньки на торті»",5,8,3
"У ЗСУ проходять військову службу і працюють понад 55 тисяч жінок – Полторак",2,3,1
"​Чого вимагають сучасні жінки?",5,4,-1
"«Головні дискримінатори» у 2017 році: мер Чернігова, ректор університету імені Драгоманова і Рада церков",7,3,-4
"У Нацполіції працюють майже 22% жінок – МВС",0,2,2
"Бізнес з нуля: переселенці з Донбасу вчать киян відкривати власні справи",2,3,1
"​ЄС повинен діяти у відповідь на кожну репресію в Криму – Ауштрявічус",12,2,-10
"Активісти вимагають визнати побиття учасниць «Фестивалю рівності» у Запоріжжі злочином на ґрунті ненависті",4,0,-4
"Права жінок: як держава може «полагодити» дискримінацію?",2,3,1
"«Жіночі» професії – ознака гендерної дискримінації – експерти",4,7,3
"Гендер є, а слова немає: чому жінки і чоловіки в Україні стикаються з дискримінацією?",5,3,-2
"Зірвали презентацію і зробили книжку Лариси Денисенко популярнішою разів у 100 (огляд соцмереж)",5,2,-3
"Журналістський матеріал Радіо Свобода став переможцем конкурсу на гендерну тематику",0,4,4
"В Одесі провели акції ЛГБТ-активісти й прихильники «християнських сімейних цінностей»",6,3,-3
"Попри стереотипи: жінки на військовому флоті",3,4,1
"На захист прайду. Сексуальні революції – індикатори соціальних перетворень",6,2,-4
"ЛГБТ-спільнота в окупації: напади, арешти та катування",6,3,-3
"Якщо це боротьба за права, то ми не повинні ховатися – Зорян Кісь",13,4,-9
"Чи зникне в Україні поділ на чоловічі та жіночі професії?",10,6,-4
"В останні роки гендерна політика України дуже нагадувала «голову професора Доуеля» – Марфа Скорик",2,3,1
"Швеція надала Україні 5 мільйонів євро на утвердження гендерної рівності – Кабмін",3,5,2
"Жінки Ірану дискримінуються на професійному рівні – HRW",3,3,0
"Розмаїття по-українськи. Підтримка національних культур і прояви гомофобії?",3,1,-2
"Травневі свята мають сенс, крім суто «картопляного» 2 травня – Магда",5,2,-3
"Пост-«безвіз»: чи залежить остаточне рішення ЄС від ухвалення нового Трудового кодексу?",11,5,-6
"«Безвіз» для Грузії вже діє. На черзі Україна",4,5,1
"Порошенко не підтримає Трудовий кодекс без антидискримінаційних норм – Цеголко",0,4,4
"«Жінки з України сексуальні, покірні й пробачають зраду» – скандал на телешоу в Італії",6,1,-5
"У Дніпрі з нагоди 8 березня провели акцію проти насильства щодо жінок",1,1,0
"Єврокомісія з нагоди 8 березня: жінки залишаються найбільш уразливими під час конфліктів",0,2,2
"Чи дискримінує Декларація прав дитини права батька?",9,1,-8
"Жіноча сила: за що українські феміністки вийдуть на марші 8 березня",11,0,-11
"В МЗС почали курс євроатлантичної інтеграції для посадовців",0,1,1
"Чи мають посадовці відповідати за свої дискримінаційні висловлювання?",7,3,-4
"У Вашингтоні противники Трампа побили вітрини і перевернули смітник",3,7,4
"Сотні тисяч людей збираються у Вашингтоні на інавгурацію Трампа",2,8,6
"Як відбуватиметься інавгурація Трампа",8,20,12
"Рожевий – для дівчаток? Дещо про гендерні стереотипи",13,0,-13
"В Україні сексизму нема?",6,6,0
"Любити і бути «ніким» одне одному. Як живуть одностатеві пари?",5,0,-5
"Підтримка незалежності України сьогодні така ж, як і 25 років тому",0,1,1
"Якого меморіалу бракує в Москві? ",21,6,-15
"Українські «скрепи» у Раді: закони про боротьбу з насиллям у сім’ї",4,2,-2
"Порошенко вніc до парламенту законопроект про запобігання насильству щодо жінок",1,1,0
"У Львові почався «Форум видавців», де обговорюють і книжки, і політику",2,2,0
"Виселивши ромів, жителі і влада Лощинівки відкрили «скриню Пандори» – Філіпішина",13,4,-9
"Дискримінація за етнічною ознакою неприпустима – офіс омбудсмена про події в Лощинівці",0,1,1
"Активістка за права жінок в Ірані розгорнула плакат на Олімпійських іграх",3,0,-3
"Складно говорити про насильство з боку тих, кого суспільство вважає героями – вірменська правозахисниця",13,2,-11
"День проти гомофобії: в України сумнівний прогрес",12,2,-10
"Санкції тим, хто заборонив Меджліс – Європарламент",13,1,-12
"Переслідування кримських татар Росією слід припинити негайно – єврокомісар",3,1,-2
"Комітет Ради з прав людини засуджує зрив фестивалю рівності у Львові",1,0,-1
"Здорового глузду від Путіна чекати не варто, тільки тиск, тільки санкції – депутат про звільнення Савченко",12,4,-8
"І прихильники, і супротивники 8 Березня не готові говорити про реальні проблеми жінок – експерт",4,2,-2
"Жінки в ЄС стикаються з насильством і недостатньо представлені у владі – єврокомісар",3,2,-1
"В ОБСЄ закликають активніше діяти для досягнення гендерної рівності",5,4,-1
"Жінки можуть стати новим обличчям сучасної України – Максимович",6,5,-1
"«Європеїзація» України: настає час демонструвати результати",2,1,-1
"Після реформ правової системи України потрібні результати – єврокомісар",1,0,-1
"Ліза Кузьменко про антидискримінаційну поправку: «толерантність виховується прикладом»",9,1,-8
"Депутати провалили «безвізовий» день. Останній шанс у вівторок",9,2,-7
"Рада ухвалила за основу перші 4 законопроекти з «безвізового» пакету",7,0,-7
"Рада в першому читанні ухвалила новий Трудовий кодекс",3,1,-2
"Чи карають в Україні гомофобів?",7,2,-5
"Жінки у політиці: для кого мода, для кого – панацея",8,3,-5
"Як прийняти сина-гея чи доньку-лесбійку?",13,0,-13
"Гройсман: 6-9 жовтня Рада розгляне законопроекти щодо лібералізації візового режиму",2,1,-1
"Сексизм проникає в соціальні мережі – правозахисники",8,3,-5
"Гендерні квоти: у політичній силі має бути не менше ніж 30% жінок",2,0,-2
"Нобелівський лауреат залишив посаду в університеті через свої слова про жінок",0,1,1
"«ЛГБТ на окупованій території пішли у підпілля» – правозахисник",8,6,-2
"Гармонія подружнього життя: «Щастя в 4 руки»",1,1,0
"Квоти для жінок у парламенті – рішення гендерних проблем?",4,1,-3
"Жінок необхідно залучати до ухвалення політичних рішень – посол Швеції",1,0,-1
"КПУ нарешті відійде у минуле і буде засуджена – Сінченко",14,13,-1
"У Дніпропетровську жінки провели акцію «проти свята тюльпанів та шоколаду»",4,1,-3
"ОБСЄ: роль жінки у запобіганні та врегулюванні конфліктів – неоціненна",2,6,4
"Французька дослідниця – про жіноче обличчя війни",9,1,-8
"Генсекретар ООН закликав до гендерної рівності і боротьби з насиллям над жінками",2,4,2
"Насильство щодо жінок в Україні переходить «у тінь» – представник омбудсмена",4,1,-3
"Як живуть новітні «діти війни»?",6,11,5
"В Україні є загроза повернення крайньої бідності – ПРООН",10,7,-3
"В Україні понад 560 тисяч внутрішніх переселенців – офіс омбудсмена",0,6,6
"Жінки-депутати більше не окраса, а дієва сила – експерт",4,3,-1
"Україна має розширити представництво жінок у політичному процесі – ОБСЄ",0,3,3
"У персоналу є 20 хвилин, щоб спустити лежачих дітей у підвали під час обстрілів – Філіпішина",4,1,-3
"Лутковська про звільнення Савченко, Росію та про банду, що катує людей",16,7,-9
"Українська льотчиця Надія Савченко. Дещо з біографії",3,3,0
"Жінки Дніпропетровська вимагають від МЗС тиснути на уряд Росії для звільнення Надії Савченко",2,0,-2
"Від гомофобії програє все суспільство – Шеремет",0,1,1
"Змова бездіяльності навколо заборони дискримінації ЛГБТ",6,7,1
"Грузинські жінки не хочуть, щоб їх перевіряли на незайманість",1,0,-1
"Інколи депутат «одягнутий» у бюджет цілого району – фотокореспондент",1,0,-1
"Успішності жінок заважають суспільні стереотипи?",0,1,1
"«Святкувати» боротьбу складно, тому я боротьбою займаюся – феміністка",0,1,1
"13% українських сімей ледве зводять кінці з кінцями – екс-заступник міністра",1,0,-1
"Чому жінок не пускають на «владну кухню»?",1,0,-1
"Чому в українській політиці так мало жінок?",1,0,-1
"Статева нерівність на робочому місці",0,1,1
"За ознакою статі. Гендерна рівність чи дискримінація?",0,1,1
"Гендерна рівність на роботі",0,1,1
"Політична відповідальність: непрості елементарні речі",2,1,-1
"Яка пенсійна реформа потрібна Україні?",1,0,-1
"Школярка з Каховки перемогла в Європі на конкурсі дитячого малюнку",1,0,-1
"Українці незадоволені дотриманням своїх конституційних прав",1,3,2
"На Азарова подали до суду за гендерну дискримінацію",3,2,-1
"В Україні гендерні проблеми опиняються поза увагою",0,1,1
