"title","negative","positive","sentiment_score"
"Міноборони: 68 тисяч жінок служать у лавах ЗСУ, з них 5 тисяч у зоні бойових дій",0,1,1
"Темники, меми, «реєстр фейків та допреальності». Як працює агенція-підрядник Кремля із дезінформації",10,19,9
"Брудна річка, булінг боксерки та «богохульське» відкриття: скандали Олімпіади",10,6,-4
"«Права людини завжди на часі» – у Києві відбувся Марш рівності на підтримку ЛГБТК+",0,1,1
"Що змінять вибори в Європейський парламент для України?",14,7,-7
"Захист прав ЛГБТК+ не на часі? Як змінився квір-активізм після початку великої війни РФ проти України",14,0,-14
"В Україні з’явиться військовий омбудсмен – Міноборони",4,1,-3
"«Я українка і я не працюю в борделі»: як українські біженки відреагували на образливий жарт шведської телеведучої",17,0,-17
"Владна партія Грузії заявила про намір обмежити права ЛГБТ",1,0,-1
"Жінки на війні: як долати «скляну стелю»",3,4,1
"Греція легалізувала одностатеві шлюби",2,0,-2
"Комісія з журналістської етики відреагувала на скаргу щодо жартів «Кварталу 95» про переселенців",4,0,-4
"Жінки в армії, політиці і владі: як змінилася гендерна ситуація в Україні",15,8,-7
"Рекрутинг замість призову: затверджено Концепцію військової кадрової політики Міноборони",1,0,-1
"У Мексиці зняли федеральну заборону на аборти",6,0,-6
"«Покоління війни»: Ігор Гордійчук про нову генерацію ЗСУ, мотивацію ліцеїстів-богунівців та сучасних героїв",20,19,-1
"Уряд Швеції ухвалив нову стратегію співпраці з Україною. Зеленський подякував за «справжню солідарність»",0,4,4
"У Дніпрі попри війну змогли організувати традиційну акцію «Ніч музеїв»",0,3,3
"Урбаністика і гендерна (не) рівність: як відбудовувати інклюзивно",6,7,1
"Зеленський привітав першу велику інвестицію в Україну з початку повномасштабного вторгнення РФ",2,8,6
"«Без захисту»: зґвалтування неповнолітньої, умовний термін, реакція правозахисників та перегляд справи",24,2,-22
"Голови МЗС Росії й Китаю не підтримали пункти про війну і ядерну зброю в декларації G20",3,0,-3
"Не хочуть бути жертвами: як війна змінює українських жінок і ставлення до них в Україні та світі",11,5,-6
"Стамбульська конвенція – не панацея проти домашнього насильства. Досвід Італії",13,6,-7
"Київ і представники понад 40 країн підписали в Лугано декларацію про відновлення України",4,2,-2
"Зеленський вніс у Раду законопроєкт про ратифікацію Стамбульської конвенції",0,2,2
"Територіальна оборона Приазов’я. Кому даватимуть зброю?",5,5,0
"«В разі мобілізації я знаю куди йти і що робити»: чотири історії українок, які мають військові квитки",11,4,-7
"Жінкам вже завтра до військкомату бігти не треба – головнокомандувач ЗСУ про наказ Міноборони",2,0,-2
"Зеленський назвав Україну «лідером демократичних перетворень»",6,5,-1
"ООН: в Україні за два роки зафіксували майже 30 інцидентів щодо журналістів та близько 20 – проти правозахисників",7,5,-2
"В ОП кажуть, що готують законопроєкт про приєднання України до Стамбульської конвенції",4,1,-3
"У день боротьби з насильством щодо жінок Україну закликали ратифікувати Стамбульську конвенцію",2,0,-2
"«Права жінок є важливими для інтеграції в НАТО»: Левченко про заяву Арахамії щодо жінки-міністра оборони",5,3,-2
"«Розумна політика»: амбіції та перспективи Дмитра Разумкова",10,9,-1
"Такі, як Оксана Линів, ламають схеми – директор Болонського театру",5,7,2
"Зварювальниця, сепараторниця та водійка великовантажної машини: історії вибору (не)жіночих професій",7,6,-1
"MediaForShe Congress: «Медіа можуть більше для гендерної рівності»",1,2,1
"Війна і жінки: трагічні наслідки для репродуктивного здоров’я",8,2,-6
"У Києві відбулася акція солідарності з жінками Афганістану",4,0,-4
"Від Колумбайна до Пермі: невмотивовані масові вбивства та їхні причини",8,4,-4
"Україна стартувала на Венеційському кінофестивалі із «Цензоркою»",12,8,-4
"«Потрібні запобіжники»: уповноважена з гендерної рівності про книгу «Щоб у 16 не було запізно»",4,0,-4
"Церква і освітяни домовились захищати «сімейні цінності» у школі. В чому тут небезпека?",4,1,-3
"Жінки у політиці: як змінювалося їхнє представництво у владі незалежної України",3,0,-3
"У МЗС розповіли, які питання обговорюватимуть на саміті перших леді та джентльменів",0,1,1
"«Жінка має бути видима в українській історії»: на полицях книгарень з’явиться видання про відомих жінок ХХ століття",5,1,-4
"Тисячі людей взяли участь у ЛГБТ-прайді в Будапешті",5,1,-4
"Олімпіада у Токіо переповнена скандалами та випадками, які викликають почуття сорому",4,0,-4
"Головне на ранок: відома дата візиту Зеленського до США, дипломати проти «Північного потоку-2» та Ліверпуль не в списку спадщини ЮНЕСКО",2,8,6
"Олена Костевич і Богдан Нікішин понесуть прапор України на відкритті Олімпіади",3,0,-3
"Євросоюз починає процедуру проти Польщі та Угорщини через порушення прав ЛГБТ",2,0,-2
"«Сі Бриз-2021» у жіночих обличчях",6,5,-1
"У ЄС і США розкритикували Угорщину за закон про заборону інформації про ЛГБТ в школах",10,0,-10
"Угорщина ухвалила закон про заборону інформації про ЛГБТ в школах",5,0,-5
"Президент Байден підсумував на пресконференції триденний саміт G7 – основні моменти",0,1,1
"У Грузії 15 партій підписали угоду на підтримку ЛГБТ-спільноти",3,0,-3
"10-а річниця Стамбульської конвенції: уряди закликали ратифікувати документ і зупинити насильство проти жінок",5,2,-3
"Міністр закордонних справ Люксембургу закликав Україну долучитися до Стамбульської конвенції",5,1,-4
"Глобальний індекс гендерного розриву: Україна втратила 15 позицій",1,1,0
"ЄС закликав Туреччину повернутися до Стамбульської конвенції",2,4,2
"Туреччина вийшла з договору про захист жінок від насильства",4,3,-1
"У партії «Слуга народу» повідомили, що запускають рух «Зе!Жінки»",1,2,1
"«У нас суспільство закритих чоловічих клубів» – блогерка Казанжи про «8 березня»",14,7,-7
"Киргизька мати кидає виклик нормам «патріархату», називаючи дітей не по-батькові, а по-матері",3,2,-1
"Чоловіки чи жінки: по кому найбільше вдарила пандемія COVID-19?",5,1,-4
"Генсекретар НАТО: Україні для вступу потрібні реформи",10,3,-7
"Спадщина Трампа: великі політичні зміни, які часто не помічали посеред галасу й скандалів",18,16,-2
"США та ЄС мають укласти нові угоди для євроатлантичних відносин – Шарль Мішель",3,6,3
"Сексизм у законі: у парламенті України хочуть дати визначення і призначити покарання",4,1,-3
"Без кричущих випадків, але безкарно. Ліхачов про напади ультраправих в Україні",5,3,-2
"З 1 січня головувати в ОБСЄ почала Швеція. Її представниця заявила, що конфлікт на Донбасі – серед головних тем",0,1,1
"Дві українські правозахисниці отримали премію МЗС Нідерландів",1,2,1
"Зґвалтування як метод катування: на окупованій частині Донбасу тисячі людей зазнали сексуального насильства",13,1,-12
"«Нам кажуть, що політика не для воїнів, але воїни є політиками» – боєць Правого сектору «Дана»",26,29,3
"Чому там лев із статевим органом, такий козак та архистратиг Михаїл у шкарпетках?",9,11,2
"Колишній міністр відкидає звинувачення в плагіаті в його дисертації",2,1,-1
"#ЖіночаСправа: мер Заліщиків Алла Квач – про спільне між політикою й стоматологією",18,16,-2
"#ЖіночаСправа: «Я можу купити собі сукню, не торгуючи мандатом» – депутатка з Херсона Юлія Єременко",11,2,-9
"«Перша аудієнція в членів королівської родини»: Зеленський зустрівся з герцогом і герцогинею Кембриджськими",2,3,1
"Що заважає батькам брати декретну відпустку і чим жертвують жінки, йдучи в декрет?",18,1,-17
"#ЖіночаСправа: Олена Ніжельська – про скасування виборів у Сєвєродонецьку, почуття небезпеки та поради «варити борщ»",9,3,-6
"#ЖіночаСправа: Тетяна Вачиля – голова Холмка, яка три роки боролася за створення ОТГ на Закарпатті",8,4,-4
"Чи є у політиці місце для жінок? Погляд депутатки та депутата",10,3,-7
"«Запоріжжя Прайд»: в оточені поліції та з затриманими",10,5,-5
"У Запоріжжі вперше відбувся ЛГБТ-прайд (фото)",4,2,-2
"#ЖіночаСправа: Ірина Ярмоленко – ексжурналістка, яка лобіювала Хартію гендерної рівності в Житомирі",12,4,-8
"Україна отримала офіційний статус учасниці «Партнерства Біарріц» – ОПУ",0,2,2
"Про ситуацію в Білорусі, паралелі з Майданом і війська в Криму: інтерв’ю з Еміне Джапаровою",20,18,-2
"Демократи США обіцяють підтримку територіальній цілісності та реформам в Україні – платформа партії",3,2,-1
"Білорусь може поховати міф про «триединый русский народ» (огляд преси)",7,6,-1
"«Слуги народу» vs ЛГБТ: для чого у монобільшості ініціюють «відповідальність за пропаганду гомосексуалізму і трансгендеризму»?",3,1,-2
"Віцеспікерка Кондратюк про відповідальність Зеленського, турборежим, закон про мову і сексизм у Раді",33,13,-20
"«Будь-який гей-прайд – це мішень». Як відбувався перший онлайн Марш рівності?",5,2,-3
"Раді пропонують зрівняти можливості матері й батька на догляд за дитиною",0,1,1
"ООН закликає Україну пришвидшити ратифікацію Стамбульської конвенції",3,1,-2
"«У мене в голові крутилась лише одна думка: хоч би мене не побили». Історія гея, якого шантажували через сексуальну орієнтацію",16,2,-14
"На сайті Зеленського петиція із закликом ратифікувати Стамбульську конвецію набрала необхідні голоси",2,2,0
"«Штраф за материнство» і навантаження на карантині – про виклики для матерів у День матері",17,1,-16
"Напад на трансгендера в Житомирі: чи карають за злочини ненависті?",5,0,-5
"Комітет Європарламенту закликав до підтримки жертв домашнього насильства",2,0,-2
"Радіо Свобода Daily: У Гаазі розпочинається судовий процес у справі MH17",5,9,4
"Феміністки та поборники «традиційних цінностей». Репортаж із Маршу жінок у Києві",19,2,-17
"Залучення жінок є ключовим фактором досягнення сталого миру – місія ОБСЄ в Україні",1,5,4
"«8 березня – це не про квіти»: у Запоріжжі вперше відбувся «Марш жінок»",2,0,-2
"У Киргизстані затримали учасників маршу за права жінок, на яких напали невідомі",1,0,-1
"Марш жінок і акція противників фемінізму відбулися в Києві",2,0,-2
"Зеленський привітав жінок, які «здійснюють подвиги щодня»",1,4,3
"Генсекретар ООН: гендерна рівність є найбільшим викликом у сфері прав людини",1,1,0
"Майже 90% людей у світі мають упереджене ставлення до жінок – дослідження ООН",2,3,1
"«Оскар-2020»: тріумф «Паразитів», провал «Ірландця» і Біллі Айліш",9,7,-2
"Будемо працювати для виконання норм Стамбульської конвенції – віцепрем’єр",1,0,-1
"Радіо Свобода Daily: Понад половина українців вважає, що вступ до НАТО – найкраща гарантія безпеки",8,5,-3
"2000 людей у світі багатші за 60% населення Землі: до чого тут нерівність статей і податок на майно",6,16,10
"Жінки у світі та в Україні. Навіщо Фінляндії жіночий уряд?",7,3,-4
"«Потім не дивуйся, сама винна». Жінки і чоловіки про фемінізм",5,0,-5
"Жінкам у світі потрібно 257 років, щоб досягти гендерного паритету в економіці – WEF",1,4,3
"Історії порушення прав людини в Запоріжжі зробили зупинками автобусного маршруту",9,12,3
"Від girl power до партнерства. Акценти Українського жіночого конгресу-2019",8,4,-4
"«Шрами»: історії насильства над жінками, які потрапили на сцену",17,3,-14
"Хто є хто в новій Європейській комісії?",3,5,2
"Фемінізм після #MeToo: у Києві стартує арт-лабораторія «Метаморфози»",3,1,-2
"«Чоловіки мають зробити одну дуже просту річ» – Кулеба про гендерну рівність",2,0,-2
"«Російський президент приїде до України і схилить голову перед монументом героям АТО» – віцепрем’єр Кулеба",25,42,17
"«Потім він писав, що я маю покаятися»: як розслідуються гомофобні напади в Україні",22,2,-20
"Реп про рівність, колискова про війну: 10 українських треків вересня",7,8,1
"Зеленський підписав указ про цілі сталого розвитку України до 2030 року",0,1,1
"«Креативний хаос»: що так і не так з гендерною політикою в Україні",2,0,-2
"​Міністр оборони про розведення військ, реформи в ЗСУ та знайомство із Зеленським і Коломойським",23,27,4
"Вікторія Нуланд про Україну, політику і баланс між роботою і особистим життям",5,2,-3
"29 липня – Всесвітній день екологічного боргу: людство вичерпало річний запас ресурсів",2,0,-2
"У Запоріжжі чиновник дав поради жінкам щодо одягу й поведінки, йому відповіли флешмобом",7,2,-5
"Депутатки VIII скликання. Якими ми їх запам’ятаємо?",0,2,2
"Правозахисники і влада США закликали Грузію гарантувати безпеку учасників акції ЛГБТ",5,0,-5
"Баланс у списках: скільки чоловіків і жінок висувають партії у Верховну Раду",5,3,-2
"Жінок у Раду: активісти закликають партії дотримуватися гендерних квот",11,3,-8
"Експерт ООН із питань ЛГБТ закликав владу України сприяти толерантності",7,1,-6
"Що має робити перша леді країни – приклади дружин президентів США і світу",1,4,3
"«Суто чоловічі» та «жіночі» професії: як боротися зі стереотипами?",6,3,-3
"«Вітаємо в пеклі»: навіщо потрібні конкурси краси в університетах",22,25,3
"В ООН заявили про тенденцію обмеження прав жінок у світі",5,2,-3
"«Треба карати чоловіків». Депутатки розповіли про дискримінацію жінок в Україні",8,13,5
"Найкращі держави для жінок: які місця посідає Україна в рейтингах?",3,1,-2
"Сім українських спортсменок-руйнівниць стереотипів про «тільки чоловічі» види спорту",22,6,-16
"Вітати чи не вітати? Як змінилось ставлення до Міжнародного дня жінок (огляд)",3,7,4
"Як українська курсантка була британською кадеткою",6,5,-1
"«Вчися, як дівчинка»: як в Україні створюють освіту без дискримінації",11,6,-5
"МЗС Франції заплатить штраф за недостатню кількість жінок на важливих посадах",1,0,-1
"В Індії третя жінка зайшла в індуїстський храм, попри протести",1,2,1
"Радіо Свобода Daily: Радник Порошенка назвав «маячнею» заяви про припинення оренди УПЦ (МП)",6,4,-2
"В Індії почалися протести після того, як жінки зайшли до індуїстського храму",1,2,1
"Гендер розбрату: Турчинов проти Левченко",6,11,5
"МЗС наступного року проведе гендерний аудит – Кислиця",1,0,-1
"В ЄС хочуть зміцнити підрозділ, що бореться із фейками",6,4,-2
"Спільнота ЛГБТІ: що змінилося за останні три роки та яка позиція МОЗ",3,4,1
"5 невирішених проблем ромських жінок із компактних поселень",2,0,-2
"Пожежниці і жінки-водолази: що змінилося за рік після скасування «заборонених професій»",3,1,-2
"#Я захищаю її: юристки розповідають про множинну дискримінацію жінок в Україні",1,1,0
"Конкурс «Міс Україна» дискримінує переможницю Дідусенко, решту учасниць і жінок загалом – Мельниченко",13,17,4
"Об’єднання протестантів: чи залишиться церква відокремленою від держави",3,1,-2
"Гібридне сміття і як його прибирати",2,4,2
"Міністерство закордонних справ першим в уряді приєдналося до руху за рівність HeForShe",1,0,-1
"В Єврокомісії вшанували пам’ять жертв нацизму та сталінізму",2,2,0
"У Запоріжжі засудили нападниць на учасниць «Фестивалю рівності» 2017 року",14,1,-13
"«Бути проти Росії зовсім не означає бути за Україну» (світова преса)",3,6,3
"Канада побачила прогрес України у гендерній політиці",0,3,3
"У Кривому Розі розпочався «молитовний марафон» проти маршу ЛГБТ",1,1,0
"Україна зробила крок уперед після Євромайдану – канадський міністр Марі-Клод Бібо",3,7,4
"З 1 липня в ЄС посилюють захист прав мандрівників",1,1,0
"Під Радою відбувся протест проти ЛГБТ і дій поліції на Марші рівності",2,0,-2
